### ISSUE TITLE
random TCP connection drops in test suite

### ISSUE THREAD

**Issue by kavon** [halo-project/halo#6]
We should be using keepalives to both detect dead clients and to prevent the connection from being dropped by intermediate carriers ([Source](http://tldp.org/HOWTO/TCP-Keepalive-HOWTO/overview.html)). 

Currently it seems that we're not responding to keepalives properly. Either this is because I've only set one end (the server) to use keepalives (as of 5aa95bff0282b664792fed627ff722a8aec61716) or the client / server is too slow to respond because it's busy/sleeping etc. Investigate.

**Comment by kavon** [comment]
It seems keepalives are not the reason for drops when running in Docker. Using `tshark -a duration:60 -i lo > packets.txt` I was able to confirm that for a longer-running version of the alma benchmark, somebody is sending a `RST` to reset the connection:

```
 2402 29.899311464    127.0.0.1 → 127.0.0.1    TCP 2615 35200 → 29000 [PSH, ACK] Seq=2682076 Ack=22 Win=43776 Len=2549 TSval=2027158193 TSecr=2027158193
 2403 29.943307624    127.0.0.1 → 127.0.0.1    TCP 66 29000 → 35200 [ACK] Seq=22 Ack=2684625 Win=3116928 Len=0 TSval=2027158237 TSecr=2027158193
 2404 29.943316318    127.0.0.1 → 127.0.0.1    TCP 3301 35200 → 29000 [PSH, ACK] Seq=2684625 Ack=22 Win=43776 Len=3235 TSval=2027158237 TSecr=2027158237
 2405 29.984865122    127.0.0.1 → 127.0.0.1    TCP 66 29000 → 35200 [RST, ACK] Seq=22 Ack=2687860 Win=3145728 Len=0 TSval=2027158278 TSecr=2027158237
```

A normal run ends with mutual `FIN`: 
```
 1666 17.339854436    127.0.0.1 → 127.0.0.1    TCP 66 35388 → 29000 [FIN, ACK] Seq=1941362 Ack=22 Win=43776 Len=0 TSval=2027447051 TSecr=2027447000
 1667 17.387539530    127.0.0.1 → 127.0.0.1    TCP 66 29000 → 35388 [ACK] Seq=22 Ack=1941363 Win=3145600 Len=0 TSval=2027447099 TSecr=2027447051
 1668 17.991190060    127.0.0.1 → 127.0.0.1    TCP 66 29000 → 35388 [FIN, ACK] Seq=22 Ack=1941363 Win=3145600 Len=0 TSval=2027447702 TSecr=2027447051
 1669 17.991219968    127.0.0.1 → 127.0.0.1    TCP 66 35388 → 29000 [ACK] Seq=1941363 Ack=23 Win=43776 Len=0 TSval=2027447702 TSecr=2027447702
```

**Comment by kavon** [comment]
The problem was that the server is sending RSTs because the test harness `test/util/run_test.sh` had a default server timeout of 30s, after which the server will stop the IO service, triggering an RST. I expected a graceful shutdown for that but oh well.

The commit fixing it reenabled keepalives on the server side and upped the harness timeout to 30mins.
